{
  "category": "context",
  "description": "Top 1000 open-source organizations on GitHub with references to their main organization pages and repository portfolio metadata.",
  "icon": "building",
  "name": "Software Vendor",
  "namespace": "misp",
  "sub_category": "organisation",
  "type": "software-vendor",
  "uuid": "d2c5f795-087c-4d15-a287-7ee0ae353875",
  "version": 2
}
