{
  "category": "named-threat",
  "description": "Name of ATT&CK Group",
  "icon": "user-secret",
  "name": "Enterprise Attack - Intrusion Set",
  "namespace": "deprecated",
  "sub_category": "actor",
  "type": "mitre-enterprise-attack-intrusion-set",
  "uuid": "1f3b8c56-1708-11e8-b211-17a60c0f73ee",
  "version": 6
}
