{
  "category": "technique",
  "description": "Bhadra Threat Modelling Framework",
  "icon": "mobile",
  "kill_chain_order": {
    "bhadra-framework": [
      "Initial Access",
      "Persistence",
      "Discovery",
      "Lateral Movement",
      "Standard Protocol Misuse",
      "Defense Evasion",
      "Collection",
      "Impact"
    ]
  },
  "name": "Bhadra Framework",
  "namespace": "misp",
  "sub_category": "technique",
  "type": "bhadra-framework",
  "uuid": "e7b7304b-9e9c-4db4-a7dd-561db4eeeb3d",
  "version": 4
}
