{
  "category": "detection",
  "description": "Sigma Rules are used to detect suspicious behaviors related to threat actors, malware and tools",
  "icon": "link",
  "name": "Sigma-Rules",
  "namespace": "misp",
  "sub_category": "rule",
  "type": "sigma-rules",
  "uuid": "9cf7cd2e-d5f1-48c4-9909-7896ba1c96b2",
  "version": 2
}
