{
  "category": "named-threat",
  "description": "Ransomware galaxy based on https://docs.google.com/spreadsheets/d/1TWS238xacAto-fLKh1n5uTsdijWdCEsGIM0Y0Hvmc5g/pubhtml",
  "icon": "btc",
  "name": "Ransomware",
  "namespace": "misp",
  "sub_category": "malware",
  "type": "ransomware",
  "uuid": "3f44af2e-1480-4b6b-9aa8-f9bb21341078",
  "version": 5
}
