{
  "category": "technique",
  "description": "Techniques from MITRE ATLAS (Adversarial Threat Landscape for Artificial-Intelligence Systems).",
  "icon": "map",
  "kill_chain_order": {
    "mitre-atlas": [
      "reconnaissance",
      "resource-development",
      "ai-attack-adaptation",
      "initial-access",
      "ai-model-access",
      "execution",
      "persistence",
      "privilege-escalation",
      "defense-evasion",
      "credential-access",
      "discovery",
      "lateral-movement",
      "collection",
      "command-and-control",
      "exfiltration",
      "impact"
    ]
  },
  "name": "MITRE ATLAS Techniques",
  "namespace": "mitre",
  "sub_category": "attack-pattern",
  "type": "mitre-atlas-attack-pattern",
  "uuid": "3f3d21aa-d8a1-4f8f-b31e-fc5425eec821",
  "version": 4
}
