{
  "category": "technique",
  "description": "Tactics from MITRE ATT&CK for ICS.",
  "icon": "chess-pawn",
  "name": "MITRE ATT&CK ICS Tactics",
  "namespace": "deprecated",
  "sub_category": "tactic",
  "type": "mitre-ics-tactics",
  "uuid": "e521606c-3c66-4621-9040-6f0f792fc999",
  "version": 4
}
