{
  "category": "named-threat",
  "description": "Adversary groups from MITRE ATT&CK for ICS.",
  "icon": "skull-crossbones",
  "name": "MITRE ATT&CK ICS Groups",
  "namespace": "deprecated",
  "sub_category": "actor",
  "type": "mitre-ics-groups",
  "uuid": "abb28bd9-fa79-4815-b5b3-fb138f433e55",
  "version": 4
}
