{
  "category": "named-threat",
  "description": "Malware and legitimate tools used by adversaries, tracked by MITRE ATT&CK.",
  "icon": "optin-monster",
  "name": "MITRE ATT&CK Software",
  "namespace": "mitre",
  "type": "mitre-software",
  "uuid": "69634931-c2d9-48ed-830a-b2a719407f9e",
  "version": 2
}
