{
  "category": "technique",
  "description": "SPARTA tactics published by The Aerospace Corporation.",
  "icon": "map",
  "kill_chain_order": {
    "sparta": [
      "defense-evasion",
      "execution",
      "exfiltration",
      "impact",
      "initial-access",
      "lateral-movement",
      "persistence",
      "reconnaissance",
      "resource-development"
    ]
  },
  "name": "SPARTA Tactics",
  "namespace": "sparta",
  "sub_category": "tactic",
  "type": "sparta-tactics",
  "uuid": "34faeaec-b2e8-5f39-b534-58b554f9cb5e",
  "version": 2
}
