{
  "category": "context",
  "description": "List of threat intelligence producer from security vendors to CERTs including any producer of intelligence at large.",
  "icon": "book",
  "name": "Producer",
  "namespace": "misp",
  "sub_category": "producer",
  "type": "producer",
  "uuid": "2d74a15e-9c88-452e-af14-d0ecd2e9cd63",
  "version": 2
}
