{
  "category": "named-threat",
  "description": "Name of ATT&CK software",
  "icon": "optin-monster",
  "name": "Enterprise Attack - Malware",
  "namespace": "deprecated",
  "sub_category": "malware",
  "type": "mitre-enterprise-attack-malware",
  "uuid": "fbb19af0-1707-11e8-9fd6-dbd88a04d33a",
  "version": 6
}
