{
  "category": "defensive",
  "description": "Activities, approaches, goals and vulnerabilities from the MITRE Engage framework.",
  "icon": "user-secret",
  "name": "MITRE Engage",
  "namespace": "mitre",
  "sub_category": "course-of-action",
  "type": "engage-framework",
  "uuid": "5dbec788-99ca-4bd7-a96f-ad0601c0f281",
  "version": 3
}
