{
  "category": "technique",
  "description": "ATT&CK Tactic",
  "icon": "map",
  "name": "Mobile Attack - Attack Pattern",
  "namespace": "deprecated",
  "sub_category": "attack-pattern",
  "type": "mitre-mobile-attack-attack-pattern",
  "uuid": "1c6d1332-1708-11e8-847c-e3c5643c41a5",
  "version": 6
}
