{
  "category": "named-threat",
  "description": "List of vendors selling surveillance technologies including malware, interception devices or computer exploitation services",
  "icon": "user-shield",
  "name": "Surveillance Vendor",
  "namespace": "misp",
  "sub_category": "actor",
  "type": "surveillance-vendor",
  "uuid": "c3a92f3a-14f1-11ea-8ab7-fb9951e35286",
  "version": 2
}
