{
  "category": "defensive",
  "description": "ATT&CK Mitigation",
  "icon": "link",
  "name": "Mobile Attack - Course of Action",
  "namespace": "deprecated",
  "sub_category": "course-of-action",
  "type": "mitre-mobile-attack-course-of-action",
  "uuid": "0282356a-1708-11e8-8f53-975633d5c03c",
  "version": 6
}
