{
  "category": "defensive",
  "description": "ATT&CK Mitigation",
  "icon": "link",
  "name": "Enterprise Attack - Course of Action",
  "namespace": "deprecated",
  "sub_category": "course-of-action",
  "type": "mitre-enterprise-attack-course-of-action",
  "uuid": "fb5a36c0-1707-11e8-81f5-d732b22a4982",
  "version": 6
}
