{
  "category": "named-threat",
  "description": "Threat actors tools is an enumeration of tools used by adversaries. The list includes malware but also common software regularly used by the adversaries.",
  "icon": "optin-monster",
  "name": "Tool",
  "namespace": "misp",
  "sub_category": "tool",
  "type": "tool",
  "uuid": "9b8037f7-bc8f-4de1-a797-37266619bc0b",
  "version": 4
}
